marketplace,customer_id,review_id,product_id,product_parent,product_title,product_category,star_rating,helpful_votes,total_votes,vine,verified_purchase,review_headline,review_body,review_date,n_reviews,sentiment_score
US,15827725,R1SB5Y367NDWO9,B001EPQSV0,352325429,"Salem Baking Company Original Cheddar Southern Classic Cheese Straws, Family Size, 9-Ounce Tins (Pack of 2)",Grocery,2,0.0,0.0,N,N,Made me sick,"I got the cheese straws in the cardboard package for Christmas, and I don't know what it was that made me sick but I ate them on two occasions and was sick on my stomach both times. They have a powdery taste, and do have a cheddar flavor so maybe it was the shortening or butter - or some spice, but I don't think I will buy any again. Disappointed because they look good in the photo.",2012-12-28,2,-0.7845
US,24157781,R3PP69RU7MA6ZK,B005K4Q37U,795563511,"Grove Square Cappuccino, Single Serve Cup for Keurig K-Cup Brewers",Grocery,1,0.0,1.0,N,Y,made me sick......!!!!!,Keurig should discontinue their partnership with Grove Square.  It tasted completely artificial.  No coffee taste at all.  It made me sick!!,2012-12-27,405,-0.7478
US,44971332,RFKBQSV785TZP,B004CH32SY,48693342,"Gimbals Scottie Dogs Licorice - Sugar Free - Black, 10 lbs",Grocery,1,0.0,0.0,N,Y,Made both people that tried these very sick.,"I ate some of these the first day I got them and I had major stomach issues all night. Thinking it must have been a fluke, I had a few pieces a couple days later and again I got sick. At this point I figured That it was just me. I gave some to a friend of mine who likes licorice, and I let him know at the time that I couldnt eat them cause they didnt agree with me. He ate a hand full and a couple hours later he called to let me know he was sick also. Not wanting anyone else to get sick, i threw almost the whole 10 lbs away.",2012-12-24,2,-0.4234
US,45916475,R3B6CGWHPGFQE9,B001KW7KMS,99539163,Bauli I Grandi Classici Profiteroles Deliicous Holiday Christmas Italian Cakes,Grocery,1,0.0,0.0,N,N,"Bad, dry, icky","I love Bauli brand Panettone.  So I thought I would try this item, I too bought it at Costco but not at a road show.<br /><br />The cake is NOT shiny chocolate like in the photo, it is dull and lifeless so not even a good presentation.  It was near impossible to slice with the proper sharp knife.  The \\""cremes\\"" are icky and artificial and nauseating.  The cake is dry and not at all fluffy like the panettone.<br />I have returned it to where I bought it as even my not so fussy kids took one bite and said NO.  Very disappointing since the picture is beautiful and I expected more from this brand.<br />I really did feel nauseated for hours after eating one slice.  That's not typical for me.",2012-12-19,5,-0.9197
US,47059712,R3MLDIE3DS0IRR,B001VNKVPE,157494270,"Frontier Orange Peel Granules Certified Organic, 16 Ounce Bag",Grocery,1,7.0,10.0,N,Y,Smells rotten,"I got this item for the fresh and clean smell of citrus.  The moment I opened the bag, I smelled rot.  It doesn't appear to be rotten, but it smelled like something died in there.  There was no fresh citrus smell at all.  It gags me to think of it.  I am unable to return this item, so it's going directly to the outdoor trash bin.  It smells too bad to even put in the trash in my kitchen.  Something was definitely wrong and it's not returnable, so I recommend not taking a chance on this one.",2012-12-16,39,-0.6426
US,10100290,R3SV2A2YQN7GAE,B002AQP5MK,409319444,"Betty Crocker Gluten Free Brownie Mix, 16-Ounce Boxes (Pack of 6)",Grocery,1,16.0,18.0,N,N,Made my daughter and I sick.,"These brownies taste really good, but if you cannot tolerate gluten, you may have a bad reaction to it as my daughter and I both did.  She and I have tried these brownies 3 times now, and every time, we have both had bad intestinal reactions as she and I are both gluten intolerant.  We unfortunately had our 3rd reaction when I made them and forgot that a few months ago we did not respond well to them after 2 tries of eating them.  Beware if you are celiac or gluten intolerant and try the Gluten Free Pantry brand which we have had very good success with.",2012-12-13,256,0.3575
US,32513207,RQ2ETN1V7ZBWM,B002V9C3GW,799123870,Sugar-free Sour Spiralz Lollipops - 4 Pack,Grocery,1,2.0,2.0,N,Y,"Horrible, icky flavor & just not good","Sorry to say but we were not happy with these at all.  I try to buy the candies that are not loaded with sugar for my kids, but these just missed the mark.<br /><br />First off, in the picture they look much larger than they really are.  And I mean MUCH LARGER.  When I received them, I was shocked when I saw them.  They are maybe the width of your finger (middle finger) and the length of it as well.  So, they are tiny.  In addition, they had shards of the candy filled in the bag where the sucker had broken in several places.  Not likely shipping caused because Amazon sent them enclosed in bubble wrap, but you never know.  The flavor was nothing to brag about.  Not sure if I just received a bad set, or if that was the standard, but I would not purchase again.  I was expecting a lot more, and better quality, for the price I paid.  I hope you have a better experience! :)",2012-12-12,9,-0.7225
US,51007532,RJXTJUQL8IVMB,B000KKQNJM,831744962,"Create-a-treat Gingerbread House Kit, Deluxe Model net wt.2.66 lbs",Grocery,1,0.0,0.0,N,Y,Big disappointment...avoid this brand.,"Our family makes these gingerbread houses every year at Christmas time - in completely different environmental conditions from hot and humid to cold and nippy. So we have lots of experience putting the houses together so they stand in any conditions. Despite it being cool and no humidity this year, the frosting in this kit was just soft and unable to hold the house sides up or the roof on. The kids finally just gave up and piled the pieces on top of one another.",2012-12-09,137,-0.3318
US,50537989,RGTGOXODOTUYZ,B002138JJI,63760107,Lucy's Cookies,Grocery,1,0.0,5.0,N,N,Made me sick :(,These tasted great but I got sick after eating them. When I looked into it turns out oats are not safe for all people with celiac disease and these cookies contain oats. They are listed as gluten free oats but apparently some percentage of celiacs react to oat avenin as if it were gluten. Wish Lucy's would have put that warning on the label. :(,2012-12-04,14,-0.6071
US,52956572,R3HU4POL8BRMNL,B0036VLZNG,522516084,Gluten Free Cafe Soup,Grocery,3,0.0,0.0,N,N,"Very salty, rubbery chicken, but you know, I'd rebuy for sick days","I bought a can of this soup at Whole Foods to have on hand for when I might get sick. Well, thsi was the month. Bronchitis. While I prefer fresh made soups--and hubby got me Thai and onion broth from restaurants--I opened this one to try.<br /><br />It's not as bad as some have written. But then, again, this company may have quality control issues. I did have the rubbery and few chicken pieces (used to that from my young days drinking Campbell's), and I supplemented it with canned organic chicken breast. The noodles were fine. Soft, mushy, slippery--which is good when one's throat is raw. The broth was just okay, and would have benefitted from HALF the salt. Super, super salty. That was the biggest drawback.<br /><br />I hope this company reads these reviews and 1. comes out with a lower sodium type 2. improves or removes the chicken (seriously, no actual chicken pieces would be better than what's in there now, and they could call it chicken broth with noodles) 3. have BPA free cans . I don't know if they do, but I assume not.<br /><br />I'd rebuy it for sickroom emergency days, but it's not great. It's adequate.",2012-11-29,91,0.6741
US,15730249,R2IF7VF24813EW,B001LIQPIQ,167375798,Ranieri - Flavoured Extra Virgin Olive Oil White Truffle - 250ml,Grocery,1,2.0,2.0,N,Y,No Truffle scent or flavor. avoid,"arrived earlier today. i was going too use it for a few things for thanksgiving.  once i opened the bottle, i noticed no scent.  i knew right away there would be little or no flavor.  tasted the oil alone on a spoon, about 2-3 drops.  just olive oil, no truffle flavor.",2012-11-22,8,-0.765
US,20967700,R5FHL64MPMC1Z,B001IZK7P4,750874032,"Eden Organic Wild Berry Mix, 4-Ounce Package (Pack of 5)",Grocery,1,0.0,1.0,N,N,Got sick,I just ate a bag of these yesterday and got very sick last night.  I'm positive it was from the trail mix.  Buyers beware!,2012-11-16,47,0.077
US,51640210,R32QJR4BD5UV7Z,B006KHR9MO,927426505,"Fontana Sauce, 63 fl oz",Grocery,1,1.0,4.0,N,Y,made me ill,I kept getting sick and thinking it was coffee that was the cause but it was this container with a green slime around the pump on the inside.  It eventually sent me to the emergency room.,2012-11-15,29,-0.6757
US,52685000,R3DZF9MC22VPTX,B007KOXRYU,491476825,Tea Forte BULK PACK Lemon Sorbetti Green Tea,Grocery,1,2.0,2.0,N,N,made me sick twice!,I drank some of this tea a month ago and within hours had a terrible stomachache and slept the entire next day.  I am a person who NEVER gets sick having missed only one day of sickness due to illness in 23 years as a teacher.  Then a few days ago I tried it again and the same thing happened.  I guess I won't try it again!,2012-11-08,2,-0.6798
US,48469054,REFSA17WMAGIM,B002DHOVPS,230093011,"Corn Pops Cereal, 12.5-Ounce Packages (Pack of 4)",Grocery,1,19.0,31.0,N,N,dangerous GMO ingredients,"If you read the label on Kellogg's Corn Pops, you will see that it contains corn, sugar, soy & cottonseed. According to the information Kellogg gave me when I called, they are using genetically modified corn, soy, sugar from sugar beet and cottonseed oil. These GMOs have not been tested long enough to prove they are safe and the first long term, independent, peer reviewed study on the GMO corn found it is linked to mammary tumors, organ damage and premature death in lab rats. Kellogg's refuses to label these GMOs because they don't want you to know. The stuff is sprayed with RoundUP and the corn & cottonseed are actually EPA Registered pesticides. My family thinks Corn Pops taste like chemicals and it is not surprising when you know what the ingredients are. Kellogg's Corn Pops gave us stomach problems. We are very sensitive to these chemicals and we have stopped buying all Kellogg's products.",2012-11-07,37,-0.8093
US,43236102,R2GZ3AHN797A8Y,B001DTIJ78,610229550,"New York Prime Meat USDA Prime 21 Days Aged Beef Rib Eye Steak Bone, 1-1/2-inch thick, 2-Count, 24-Ounce Packaged in Film & Freezer Paper",Grocery,1,9.0,10.0,N,Y,This steak took 1 week to arrive...it was two orders of rotted meat...,How do you think it smelled....therebis no way to contact them...unless i want to return rotted meat!!<br />Run from any meat that doesnot come froma butcher....<br />This is an AMAZON product....<br />I want a refund,2012-11-07,7,0.3436
US,47383745,R3R5M2UL5NEJNY,B001AY8VV0,903342911,"Marutomo Katsuo Bonito Flake Hana, 16-Ounce Units",Grocery,1,5.0,10.0,N,Y,please read - made my cats sick (or so it seems),"First of all, my cats had no problem with these flakes at first.  That's important to note.  And, I stored them properly, per the instructions on the bag.  But after awhile (perhaps because they were around for a long time), my cats started to get sick after eating them.  Here's my story - and then you can decide whether you think you want to feed your cats these flakes or not:<br /><br />Although these flakes are for human consumption, the ingredient (100% Bonito Tuna Flakes) is identical to that in other tuna flakes I've purchased for my cats.  Given the huge cost savings buying these, I thought they were a great deal, and my two cats didn't seem to notice a difference.  They ate the flakes as their nightly treat for a month, then another, and into another ....  Eventually, my cats started to get sick nearly every night or near morning. At first, I thought one or both were going through a \\""hairball\\"" period and tried their hairball treats.  Nope, that didn't do the trick.  Then I considered their food and pulled back a new kibble I had added to their regular diet given they both had dental care done a few weeks back.  No change.  So, on to the vet we went to make sure the problem wasn't a side effect of their dental procedures (e.g., infection, some other problem).  Nope - my cats were otherwise healthy.<br /><br />But the problem persisted and was becoming a real issue: I was tired of seeing them miserable (in the times I saw them during the time they were sick) and I was tired of buying (and using!) SpotShot to clean carpet stains.  Finally, in desperation, I did the only other thing I could think of - I stopped giving them their tuna flakes.  They weren't happy.  They cried at night.  I live in a rural area and was patiently awaiting the next order of tuna flakes for cats (paid for 1-day shipping, but didn't order until late on a Saturday afternoon - alas!)  Here's the amazing thing: the nightly vomiting stopped. When the new flakes arrived (from a company I used before, who also sells flakes in volume, although about 1/3 the volume of this bag), I carefully started to give them their nightly treat again.  No problem at all.  They've been fine since.<br /><br />I'm not a scientist.  I can't conclusively state the flakes made my cats sick or at what point the flakes became too old to be safe for my cats.  These flakes are labelled as for human consumption, but the ingredient is the same as what is in cat tuna flakes (although I thought these flakes might be a touch \\""smokier\\"" in scent).  But what happened is enough for me.  I won't be buying these anymore.  Not worth it.  My kitties and I are back to a happy nightly feeding schedule with their old flakes and no problems!",2012-10-27,256,-0.9409
US,38564923,R3O6T4T4VRQ0TV,B002J771J0,714255141,Nature's Hollow Sugar-Free Jam Preserves,Grocery,1,0.0,2.0,N,Y,Was rotten,"Culd not eat it, but the other flavor I ordered was fine, not sure why it was not ok, when the other one was",2012-10-26,15,-0.3767
US,46464452,RMTBU2VGH2U88,B003V019RY,879719606,Dr. John's® Sugar Free Simply Xylitol® Natural Mixed Fruit Lollipops (1 Lb.),Grocery,2,0.0,0.0,N,Y,icky sweet,"If you like really sweet lollys then these would be the best by far for you.  For me, they were just too sweet. The positive is that you just cannot believe they are sugar free!!!",2012-10-21,36,0.9685
US,15641983,R1LI6KWCLXZW6H,B006N3I18Q,881328158,"Gloria Jean's Coffees, French Vanilla Supreme, K-Cup for Keurig Brewers",Grocery,1,0.0,0.0,N,Y,Strong icky fake vanilla taste,"I bought this item after reading great reviews.  I did not like this coffee at all.  Maybe it's because I really like Dunkin' Donuts vanilla coffee.  Or the Starbucks vanilla lattes.  This coffee has a fake vanilla taste to it that has quite the bite and leaves a horrible taste in your mouth.  Some people like this coffee, but it's really not for me.  If you ever had the trader Joes vanilla creamer, it tastes similar to that, which I am not a fan of either.",2012-10-14,161,-0.7057
US,16593295,R12Z828ETEBA1W,B004JRQ3DS,979039343,Promax Lower Sugar Protein Bars (Pack of 12),Grocery,1,1.0,8.0,N,Y,Low sugar = potentially dangerous sugar substitute?,"I love these protein bars, but am a bit upset with the marketing. I thought the term \\""low sugar\\"" meant there was simply less sugar. It turns out in addition to this smaller amount of sugar, there is also a sugar substitute called \\""Stevia\\"" which may or may not cause cancer... I would rather not find out. I will not be buying any more of these. In all fairness, this detail IS in the product description - my mistake for simply looking at the image of a familiar product rather than reading in-depth.",2012-10-09,77,-0.5994
US,24074470,R3DX3P8BCT6L39,B001P1YWWK,960472432,"Barney Butter Almond Butter, Crunchy, 16 Ounce Jars (Pack of 3)",Grocery,3,2.0,2.0,N,Y,Deliciously dangerous...,"The almond butter itself is very scrumptious. I personally eat it by the spoonful! In fact, my first jar was devoured within the first day of arrival!<br /><br />Anyway, my almond butters seemed to be contaminated. After my first jar, I continued on my second jar; which was contaminated with what I believe to be salmonella or something really bad (I've done research that led me to this conclusion; lots of recalls on nuts!). The contamination caused me to vomit violently along with persistent stomach aches. THe third jar seemed to be have the protective seal broken with pinkish-oily material spread all over under the cap.<br /><br />Be careful purchasing any nut based products as of now! There are many reports of recalls and salmonella outbreaks, especially almond-laced products!",2012-10-05,133,-0.871
US,17695904,RZXFV2CNLCETM,B008216TWM,963505573,Case of Propel® Zero Cherry Lime Powder Packets - Propel Packs,Grocery,1,0.0,4.0,N,N,This stuff made me very ill.,"I got very ill from drinking this kind of Propel. I was drinking many different flavors and decided to try the powdered kind. I was so sick that I spent days in bed, and getting blood tests at my Doctor's office. One day the nurse told me to drink a lot of water and since this contains no sodium or sugar I drank about 32 ounces of it. I became sicker than ever and tried not drinking any more of it. Over night I was cured. I had itchy hives on my back and upper arms and I thought my dreded kidney disease had returned. Beware of this stuff, I don't know why it affected me that way but, I have a whole bunch of it that I'm going to trash first thing tomorrow.",2012-09-30,4,-0.6997
US,12341813,R1YEY9A05PIDZV,B00507A02Q,755228942,"blk Premium  Alkaline Water Infused with Fulvic Trace, 16.9 Ounce Bottles (Pack of 24)",Grocery,1,23.0,32.0,N,N,fulvic acid is dangerous,"Producers of BLK have recently changed their bottler (and water source), removing the \\""spring water\\"" from the label.  If these people have mixed fulvic acid with any municipal source containing chlorine or fluoride, it could be carcinogenic.  Please do your homework on fulvic/humic acids mixing with chlorine and flouride before you ingest this.  And do not use it if you are undergoing any therapy (chemo, etc.) that compromises your immune system.",2012-09-22,248,0.5423
US,50537989,RHOHHSXRKDF0S,B006LRMI5G,536453737,"Tate's Bake Shop Gluten Free Chocolate Chip Cookies, 7 Ounce",Grocery,2,2.0,3.0,N,N,Supposed to be gluten free but made me pretty sick.,"These are supposed to be gluten free but they made me pretty sick. When I looked carefully at the package it says \\""made in a faciity that also processes wheat.\\"" so I guess I can't trust it :(",2012-09-22,9,0.2288
US,35372869,R1K373S2FPGV5T,B008NYHDM8,139778507,Imperial Taste - Preserved duck eggs - 12.69 OZ. / 360 G - Product of China,Grocery,1,2.0,3.0,N,Y,Horrible!  Could they be rotten?,I don't know if preserved eggs can go bad but these were absolutely horrible.  They didn't smell like a rotten egg but they did smell really bad and the taste was even worse.  Very disappointed as this was a gift for someone who absolutely loves these eggs.,2012-09-20,1,-0.8934
US,12558141,R36XB7I2Z6GC7G,B004ACQKDK,573103301,"Vivier France (Tin) Hazelnut Oil - Huile De Noisette, 16.9-Ounce Cans (Pack of 2)",Grocery,1,1.0,1.0,N,Y,"Rancid, rotten oil","Do not purchase this crap as it will arrive rancid and the cans are dented. If I had not been so busy, I would have shipped them back. Oh!!  Good idea.",2012-09-17,1,-0.6351
US,14802075,R3B2L7NTRKEHAW,B001ELLBJS,356715615,"Great Lakes Unflavored Gelatin, Kosher, 16 Ounce Can",Grocery,1,19.0,35.0,N,Y,This stuff made me sick...,"After reading the good reviews, I decided to give this gelatin a try.  Unfortunately, I didn't read Amazon's return policy first.  I gagged trying to drink this in water, so I tried mixing it in yogurt.  Still couldn't stand the taste.  Then I felt terrible all day. After smelling it, I had concerns, but thought I might be able to mix it with something to overcome the odor.  It didn't work, and it definitely isn't worth feeling bad.  I can't imagine how so many people can tolerate this stuff.",2012-09-14,415,0.514
US,12234776,R2N022LPAFLHEH,B000EDG430,90603026,Gluten Free Homemade Wonderful Bread Mix,Grocery,1,3.0,4.0,N,N,Garbanzo beans can make you sick if you have trouble with soy,"I love most Bob's stuff, but I bought this bread mix and made rolls.  I had two in one day and woke up with terrible stomach pains the next morning.  As most of us who must stay gluten free do, I went over in my mind what I had had to eat the day before and these rolls were the only new thing.  I then researched garbanzo beans.  They are in the soybean family.  My doctor has told me that I must also be careful of soy as well as milk unless it is lactose free.  The garbanzo beans were the problem so I had to go to another brand with the other types of flour.  If you don't have a problem with soy, the rolls were very good.  Wonderful taste and very soft.  However, you may need to stay away from it if you are allergic to soy also.",2012-09-09,325,0.8425
US,20844832,R20F9U413HUTXB,B001SB2AGC,246572834,"Mr. & Mrs. T Pina Colada Mix, 33.8-Ounce Bottles (Pack of 6)",Grocery,1,1.0,3.0,N,Y,Makes you sick,"Makes you so sick, stomach hurts, stay away!!!!<br /><br />Not worth the cheap buy. Just go to the grocery store and pay a little more for good mixes.<br /><br />Or go with brand name brands instead",2012-09-06,1,-0.7475
US,22164327,R19LS127618IQ5,B002T63AZA,404074620,Premium English Pumpkin Spice Scone Mix,Grocery,1,1.0,1.0,N,N,"icky-poo sweet, inedible",Cheap and awful tasting.  No relationship to a scone.  Went right to compost bin. Can't believe this came from Seattle where I've had the best scones ever.,2012-09-01,2,0.0
US,42662768,R3V5ZEJFU770N2,B006O02832,436470986,"Black Garlic, 1lb Bag",Grocery,1,1.0,2.0,N,Y,came slimy and rotten,i ordered it for my father when i was in town and i haven't seen him. he felt bad to tell me but i just asked him and he told me they came slimy and rotten. it's over 30 days so i am beat for $25.,2012-08-25,4,-0.7717
US,51861899,R1GEWFHK0LFT4K,B0078DRQRW,260895284,"Izze, Sparkling Mandarin Esque, 6/4/12 Oz",Grocery,1,1.0,3.0,N,N,Doesn't taste good and made me feel icky,"This is like the worst of both worlds.  Flavored, unsweetened seltzer is fizzy and refreshing.  Full on soda (made with fruit juice concentrate or sugar) is sweet and tasty.  This tastes like ice cubes melted in your fizzy juice.  It's fully fizzy but the flavor is so dilute as to be very unappealing.<br /><br />Both my husband and I felt a major blood sugar drop after drinking this, which is weird given how few calories (50 per bottle) it has and that we drank it with food.  (We had completely different meals, so I'm pretty sure it wasn't the food.  And, we're both in good health.) I felt so lousy after drinking it that I read the ingredients three times to see if I'd missed some weird additive.",2012-08-24,1,-0.232
US,50371511,R24R4972EK8HP3,B000YDZ05S,329840214,"Tom's of Maine Natural Deodorant Stick, Aluminum Free, Long Lasting, Unscented, 2.25 Ounce",Grocery,1,0.0,0.0,N,N,The Unscented one is not really unscented and you end up smelling like stinky feet,"I think I covered it all in the subject. The bar itself smells kind of like lemon, so it isn't really unscented as the company claims, first of all. They also claim it protects for 24 hours, when in fact it hardly protects for 4. I should've actually typed in protects between quote signs, because very shortly after putting it on you start smelling strange and as time goes by, it becomes a nasty smell, literally like feet that have been wearing sneakers in humidity. I am not overweight nor do I have strong bodily odor, but what I do have is a strong sense of smell. Honestly, I think the only way you could actually vote this product highly is if you: (1) have very poor sense of smell; (2), if you're 9 years old and still have extremely low pheromones; or (3), if you were paid to say so. If you wanna give it a try, I suggest you buy personal cleansing moist toilettes for when you're at work or away from home, and make sure you take the deodorant with you to reapply, because you're gonna need it. Perhaps this could be your cheap option for when you're at home, and you can have a better deodorant for when you go out? Personally, that's not enough for me, though. I've used way better deodorants that are not antiperspirants.",2012-08-16,28,0.6787
US,26482864,RVUVROF4PJTWG,B00866AM2G,817362415,"Vita Coco Coconut Water, Pineapple, 16.9 Ounce (Pack of 12)",Grocery,1,1.0,1.0,N,Y,Vita Coco is usually great but avoid the seller,"I love Vita Coco and thats why decided to go for this product. However, when I received the package - I was totally disappointed. I have opened 4 packs and all are used. Usually, every pack has two seals - one on the top and one at the surface of the pack. The one at the surface is broken suggesting it is a refilled and not original Vita Coco. I will highly advise you against this seller. Please avoid at any cost.",2012-08-02,199,-0.3302
