marketplace,customer_id,review_id,product_id,product_parent,product_title,product_category,star_rating,helpful_votes,total_votes,vine,verified_purchase,review_headline,review_body,review_date,n_reviews,sentiment_score
US,32741511,R2W3UQ81RG7FWI,B003IEFXL6,874596093,Purple Dendrobium Orchids (10 stems Orchid with Rhinestone Mesh Ribbon Vase),Grocery,3,0.0,0.0,N,Y,Ordered for my sick cousin,"Feedback from the receiver:  These flowers were pretty, but the vase was &#34;too big&#34; for the flowers.  Her daughter actualy brought a vase from home to the hospital because it bothered them.  Also, delivery was not as prompt as I expected, a day later than expected.",2013-12-28,241,-0.2144
US,20959167,RYSSK84WB5ETX,B0028VZEJQ,15684650,"Roland Pearled Farro, 3 Pounds",Grocery,3,0.0,0.0,N,Y,Great price on bulk Farro--freeze to avoid bugs!,"Our local upscale grocer carries Farro in smaller packages, and is often sold out. I saved a substantial amount buying here in bulk, and it arrived quickly. I'll be back for more. Yummy stuff, if you like brown rice, you'll love Farro.  Updated:  After several months, I noticed that there were living BUGS in the bag. I threw it away, after using maybe 1/3 of it.  If you buy bulk Farro (or any other grain) please know that you should FREEZE it for a couple of days to kill any bug eggs. I now freeze rice, too.",2013-12-26,90,0.914
US,26361472,R2WBQCYCJJ7ZMT,B001ET5XXK,120515161,Café Bustelo Coffee Espresso,Grocery,1,0.0,6.0,N,N,made me sick....,"i got this from local stop and shop.<br /><br />honestly i don't know what's different about this stuff but it has been producing weird bad effect with me. the first time i used it, yea, high buzz. then the second day less.  then ever since it's  been producing weird, confusion sensations.<br /><br />i been testing this for some time ad enough so far.  it's  been ruining my sensations for  days, i decided to stop using this stuff. definitely, inconsistent effects and weirdness with stuff.  i had other brands like this but not everyone makes stuff like this.<br /><br />definitely better brands out there i tried.<br /><br />and let's face it, coffee isn't something that pleasant in taste, the intention is the stimulus effect. if there's no stimulus and even worse, if it produces confusion, i don't think i want to bother...<br /><br />very unsatisfied with this product.",2013-12-22,74,-0.969
US,40810107,R14680XHROCL6N,B004TJD72Q,524143418,Amazing Grass Raw Reserve Green Superfood Formulas,Grocery,2,39.0,48.0,N,Y,"if you've GERD, avoid this","This gives me the boost of energy but at a cost, I was left with burning irritation in my mouth and throat for few hours everytime I drank it as if I've just had some hot chilli soup. It took me a while to figure out what was causing it but as I started taking note of what I was eating, I found that this bottle has nasty cayenne pepper in it. Seriously, why would they need to put this stuff in it, take this pepper out, I'll buy it next time, for now this is my first and last bottle. I bought into all these positive reviews. Sorry, but I had to post this so other GERD sufferers don't have to go through all the hassles.",2013-12-22,121,-0.8897
US,47545021,RR8YYQHZEYRUH,B00BTMDALO,290974606,Miracle Noodle Gluten-free Shirataki Pasta,Grocery,1,3.0,5.0,N,N,WARNING!! Product can make you seriously ill!,"i prepared this product with pasta sauce and actually really liked it, however THE PRODUCT MADE ME VIOLENTLY ILL.  I could not leave the bathroom for three hours and for two days afterwards I had serious gas and bad stomach pains, like someone was stabbing me in the stomach.  If something is too good to be true (no calories), then it usually is.  My advice is to eat a little at a time to see if you can tolerate it.",2013-12-22,665,-0.5147
US,12001581,R2OZH2DUHZG837,B005B3HKPO,186958080,"Premium Avocado Oil from California, by Bella Vado",Grocery,1,7.0,13.0,N,Y,It's like rotten avocados,"I am so sad to report how much I hate this avocado oil!  It smells & tastes just like rotten or at least super over-ripe avocados.  I really don't know how anyone can tolerate it.  Even my husband who likes his avocados very ripe couldn't use it.  I have been looking for an organic, unrefined avo oil, but this one is unbearable.  I'm going back to the refined one I used to buy until I find something else.",2013-12-17,89,-0.2236
US,51881294,R2L700FZ42TFJI,B003TVSTMI,660478303,Knorr Bouillon,Grocery,1,3.0,5.0,N,N,"Just tastes like salt.  Also includes MSG, which is something you should avoid","It just tastes like salt.  I didn't taste a cilantro flavor.  It would be better to pick up some fresh cilantro at the grocery store or use something like [[ASIN:B000WS1KH2 Simply Organic Cilantro Certified Organic, 0.78-Ounce Container]].<br /><br />The main ingredients listed on the Knorr Minicubes box are salt and monosodium glutamate (MSG).<br /><br />There is a lot to dislike about MSG.  See [[ASIN:B003UNL8LY The Truth About Aspartame, MSG and Excitotoxins]]. Here is a short segment from the book:<br /><br />Mike Adams: I'm here with Dr. Russell Blaylock, and I'd like to explore some of the more advanced aspects of some of the things you are working on. Dr. Blaylock, I think readers know the basics of both MSG and aspartame, but can you review what you've already written about excitotoxins?<br /><br />Dr. Russell Blaylock: I have three books. The first one is the exeitotoxin book, \\""Exeitotoxins:<br />The Taste That Kills,\\"" and the latest one is and updated paperback reprint of \\""Health and Nutrition Secrets That Can Save Your Life.\\"" The third one is \\""Natural Strategies for Cancer Patients,\\"" which is directed at nutritional treatments for cancer. It contains some material about aspartame and MSG.  Excitotoxins have been found to dramatically promote cancer growth and metastasis. In fact, one excitotoxin researcher noticed that, when cancer cells were exposed to glutamate, they became more mobile, and you see the same effect with MSG. It also causes a cancer cell to become more mobile, and that enhances metastasis, or spread. These MSG-exposed cancer cells developed all of these pseudopodia and started moving through tissues, which is one of the earlier observations from cancer.",2013-12-14,9,-0.9869
US,22515444,R2E7P4N8ZT9EYF,B004TJF39Q,43133608,Grove Square Caramel Apple Cider,Grocery,1,0.0,0.0,N,Y,Tastes rotten!,This stuff tastes like the bruised spot on an apple. It really was not good. I would definitely not purchase this SUGAR FREE version ever again!,2013-12-14,67,0.4399
US,36319206,R1UJQBRC0RHX6L,B00999I3Z2,674680943,"Campbell's, Chunky, Chipotle Chicken & Corn Chowder Soup, 18.8oz Can (Pack of 6)",Grocery,1,1.0,1.0,N,N,rotten eggs,"I got sick just over week ago but had no idea what it was.  I knew it was something I ate.  Well, I ate this last night and found out it was this soup!<br />The next day there is a horrible sulfur aftertaste that keeps coming back and back and back.<br /><br />I actually got online to see if it had been recalled.  There is something seriously wrong with this soup.  I might call Campbell's.",2013-12-13,4,-0.9266
US,14747805,RZT6KFIKBDPNF,B000SATIBO,792561286,Davidson's Tea Bulk,Grocery,2,2.0,3.0,N,Y,"icky, overpowering herbal shampoo smell and taste, where is the earl grey flavor?","Whoa, ok-I trusted that this was going to be a good tea because so many people had such good reviews. I figured I could at least appreciate it even if it was a little different from the norm. upon opening the bag-which I was quite excited to receive, I was overwhelmed with the aroma, not of tea, but of some herbal shampoo I've used in the past. Very much like a pure essential oil, hardly any tea in the aroma at all. And the same is true of the taste, the oil of bergamont is so strong that the tea is an afterthought. I love earl grey and I wish this was at least somewhat like that taste. Looks like I'll be continuing my search for a really quality earl grey loose leaf tea. I don't even know If I can give this to anyone...its so overpowering and the oil of bergamont has that bitter aftertaste... sooooooooooo disappointed-what do I do with this stuff?......",2013-12-13,335,0.9868
US,29883620,R1RBNVPZNV20NT,B00BP36S7U,290974606,Miracle Noodle Gluten-free Shirataki Pasta,Grocery,3,0.0,0.0,N,Y,stinky but good tasting,This has an amazing texture but bad  fish smell. The texture is like jello beads or tapioca. The smell is pretty rough though.,2013-12-13,179,0.6369
US,8547793,R35O30B0AEA3YT,B005GNICKQ,340036861,Milk-bone Treat & Play Milk-Bone Biscuit Size Medium,Grocery,1,2.0,2.0,N,Y,dangerous!,My miniature pinscher chewed pieces off it first day she had it threw it in trash!!! Dangerous / hazardous for any animal.,2013-12-12,4,-0.6093
US,30886931,RE1RH8S37EFUC,B008F2K1YU,453849198,Ekobrew Refillable K-cup Starter Kit for Keurig 2.0 and 1.0 Brewers,Grocery,1,0.0,1.0,N,Y,"Ekobrew itself is fine, avoid the gift pack.","Received this and the spoon and cup broke within a week. Company said they would replace but never did, wouldn't buy the gift pack but would buy just the ekobrew.",2013-12-10,54,-0.6135
US,44598068,R1SUWWFA0BQNJ4,B000FFLHSY,985687682,Navitas Naturals Organic Goji Berries,Grocery,1,12.0,13.0,N,N,CAUTION may be making you sick,"I have had good luck with these in the past, but berries from the last two bags have given me stomach pain and severe diarrhea.  I used to have them with oatmeal, and it took me a couple of days to figure out that it was the GOJI berries that were causing it because it would take an hour or so before it would hit.  That was over a month ago, today I decided to try a couple of berries from a new bag and again I had stomach pain a severe diarrhea.  The current bag that is making me sick says &#34;best by 03/18/15, LOT #2501326121&#34;",2013-12-07,753,-0.9595
US,46600842,REQR21F556DBB,B001EO5Q64,653570135,"Nutiva Organic Virgin Coconut Oil, 15 Ounce",Grocery,1,4.0,8.0,N,Y,Made me sick,I've been trying to eat healthier so I bought this coconut oil. EVERYTIME I used it in something I felt sick. At first I didn't make the connect but then I specifically made something with this in it and made sure that I wasn't allergic to anything else and it just made me feel sick. I then thought maybe it is just coconut oil in general but when I went to my mom's house and made something with her coconut oil I didn't feel sick at all. I wont be buying this again.,2013-12-06,2636,-0.7762
US,13264088,R17VW73A6HWKCH,B001EO5Q64,653570135,"Nutiva Organic Virgin Coconut Oil, 15 Ounce",Grocery,1,3.0,14.0,N,Y,"Unless you love everything tasting like coconut, avoid.","This product shipped quickly and when it arrived both jars of oil had melted so they were sloshing around inside so we had to wait to open them. When we used this oil, it made all our food taste overwhelmingly like coconut. We are NOT coconut people, so this was really disappointing. If you love the taste of coconut, you should use this for cooking, otherwise I'd avoid it.",2013-12-06,2636,0.1298
US,43099938,RDVCY7SWORIBM,B00910V8YM,441964590,"Green Cow Beef Trachea, 15 Count",Grocery,3,0.0,0.0,N,Y,"Really stinky, but the dogs love 'em!","I have to first say that all three of my medium-sized dogs LOVE these.  I purchased them when I was unable to get the Green Cow rawhide bones any longer and thought I'd see how these were received by my dogs.  Not sure how effective they are for cleaning their teeth, as the package claims, because the dogs each chewed theirs up within minutes.  They seem to be sort of the consistency of pork rinds rolled up like a tortilla...if that makes sense.  And it's too soon to know if they will agree with their tummies.  Now for the not-so-good...they are some of the foulest smelling things I have ever smelled.  I would say they rank right up there with dirty undies but worse, and you can smell them without even opening the bag they came in.  Not sure I will buy them again, which will sadden my dogs.",2013-12-05,3,-0.8816
US,43320810,R2WNDSFMLRBEK1,B00AZWWIRQ,155983669,"Pacific Natural Milk, 6 Count",Grocery,2,1.0,1.0,N,N,"Terrible Flavor, avoid at all costs.","I bought the unsweetened Vanilla flavor because the sweetened kind upped the calories in a major way (70 to 160). I can't think of anything in my adult life that I could use this for. I tried it on honey flake cereal and it tasted like I poured dirty water on it. Please get the sweetened kind if you are curious.<br /><br />Not a hint of vanilla flavor, can't imagine drinking it plain or in coffee. Expensive for watered down milky grey hemp liquid.<br /><br />For the omegas, I would highly recommend adding hemp oil to your smoothies, cereal, etc. or or tossing some hemp seeds in your cereal if that's what you're looking for.<br /><br />Rice milk is way yummier.",2013-12-03,5,0.8932
US,23043973,RECYDQSJDTKS0,B007DZYH18,860122199,MIXED CONGEE 12x13.4OZ,Grocery,2,5.0,6.0,N,Y,"No expiration date, kind of made me ill","I have bought this stuff at the local Asian food store and liked it a lot.<br /><br />For some reason the cans I bought from this merchant made me feel slightly off and gave me a headache.<br /><br />I'm not sure if this is related but I noticed there's no expiration date on the cans.<br /><br />Since the cans were pretty beaten up and the label was faded, there's no way to tell how old the product actually is but I'd guess it was pretty far past its expiration date.",2013-12-02,1,0.1825
US,49098528,R16XCVBWZVVRF2,B003VIL6GU,217677011,"Pacific Foods Organic Poblano Pepper and Corn Chowder, 17-Ounce Cartons, 12-Pack",Grocery,2,11.0,12.0,N,Y,"Good Soup, but be careful if you need to avoid sugar.","I purchased the Poblano Pepper and Corn Chowder and the Roasted Garlic Mushroom Lentil soups by Pacific based on the ingredients portion of the label that was posted alongside the picture of the soup.  My problem with these soups are not the taste per se.  They taste fine and I rather enjoy the Garlic Mushroom Lentil. In both cases, the ingredients that were initially posted were simply, natural and basic (meaning no un-necessary additives).  Well imagine my surprise when I discovered that the ingredients of the soups I received in no way shape or form matched what you see on the labels.  Specifically, both soups now contain sugar (something that was not always the case), which is something that I think should be more clearly stated for people who might have issues with eating food that contains that item.  It appears that at some point, the ingredients were altered, which is fine but when it comes to things like sugar, salt, and certain preservatives, I think the manufacturer should make their inclusion in the product very clear.",2013-12-01,20,0.9251
US,49098528,R2KJ7FPLQHWWDC,B003VIJHU2,698705434,"Pacific Foods Organic Roasted Garlic Mushroom Lentil Soup, 17 Ounce Cartons, 12-Pack",Grocery,3,2.0,3.0,N,Y,"Good soup, but be careful if you need to avoid sugar","I purchased the Poblano Pepper and Corn Chowder and the Roasted Garlic Mushroom Lentil soups by Pacific based on the ingredients portion of the label that was posted alongside the picture of the soup.  My problem with these soups are not the taste per se.  They taste fine and I rather enjoy the Garlic Mushroom Lentil. In both cases, the ingredients that were initially posted were simply, natural and basic (meaning no un-necessary additives).  Well imagine my surprise when I discovered that the ingredients of the soups I received in no way shape or form matched what you see on the labels.  Specifically, both soups now contain sugar (something that was not always the case), which is something that I think should be more clearly stated for people who might have issues with eating food that contains that item.  It appears that at some point, the ingredients were altered, which is fine but when it comes to things like sugar, salt, and certain preservatives, I think the manufacturer should make their inclusion in the product very clear.",2013-12-01,16,0.9251
US,24933243,R21M0DU9CCFGQX,B0040DWCXG,753363696,Xanthan Gum 1lb Powder USP FCC Food Grade,Grocery,1,2.0,23.0,N,N,Possibly dangerous toxic reactions to Zanthan Gum - Please do your research before buying,"I'm not allergic to any foods.  This Thanksgiving I went to my sisters, she made gravy with Zanthan Gum.  Shortly after sampling the gravy I had a severe anaphylaxis reaction; my face looked like a puffer fish, my heart was racing, vertigo, my tongue started to swell - an Epi Pen had to be administered to prevent possible death.<br /><br />I'd caution against use of this or at a minimum do your research! I'd say Gluten is much safer than Xanthan Gum. Although Xanthan Gum is in many foods as a preservative, this product by is used in excess to what most food manufacturers include in their products.  Please at least look up Xanthan Gum in Wikipedia or other reliable sources before using.<br /><br />Certainly would never give to children!  Also, google \\""Simply Thick\\""(includes ingredient Xanthan Gum) to see new FDA recommendations based on numerous deaths, and ongoing lawsuits, of babies dying a direct result of Simply Thick added to their formula.",2013-11-30,200,0.716
US,22357766,RPGE9MIKPLDK5,B004AWTR6M,359524523,"Green Mountain Naturals Keurig K-Cups, 72 Count",Grocery,1,0.0,2.0,N,N,For some reason these always make me sick.,I've always gotten this every year hoping they would change their recipe. So far no luck. It tastes fine however it smells so much better. I personally can not drink this because it gives me bad heart burn for whatever reason. In the end I always end up giving them to someone else.,2013-11-30,452,0.7553
US,24933243,R2ALSBGN9V2EWS,B00015UC6Q,661621716,"Xanthan Gum, 4 oz.",Grocery,1,8.0,15.0,N,N,Possible dangerous / deadly toxic reactions to product if used in quantities greater than .5% of total food or liquid volume,"This Thanksgiving I went to my sisters, she made gravy with Zanthan Gum.  Shortly after sampling the gravy I had a severe toxic reaction; my face looked like a puffer fish, my heart was racing, vertigo, my tongue started to swell,  I developed sepsis and my lungs partially collapsed.<br /><br />The packaging does not provide any guidance or black box warning (as it should!) about the severe toxicity if used in quantities greater than .5% of total volume of food or liquid.  The manufacturer is negligent and even deceptive in marketing this manufactured product as if it were all natural.<br /><br />Xanthan gum is a largely indigestible polysaccharide that is produced by bacteria called Xanthomonas Camestris.  Manufacturers place the bacteria in a growth medium that contains sugars and other nutrients, and the resulting product of bacterial fermentation is purified, dried, powdered, and sold as xanthan gum. (Makes you wonder who first thought to put it in food, doesn't it?)<br /><br />In other words, xanthan gum is an industrial processed product--  It is a polysaccharide produced by a biotechnological fermentation process--a chemical. There is nothing natural about xanthan gum.<br /><br />Certainly never mix or serve to small children until the dangers are fully explained by the FDA's ongoing investigations. Currently, there are on-going lawsuits as a result of Xanthan Gum being added to baby formula to thicken it, the babies intestines developed holes and collapsed, resulting in deaths.<br /><br />FDA has issued new cautions and studies as to this food additive's safety. It certainly should not be sold in bulk giving the appearance that it is a flour of some type very misleading and possibly deadly.  We'll likely all hear more soon on this issue - just be cautious and know what and how much you are putting into your food and body - or your family's.<br /><br />One lesser-known use of xanthan gum is in the oil industry. As a thickener, it can be added to drilling fluid or drilling mud to improve its function. Drilling fluid serves several purposes, including cooling the drill bit, providing hydrostatic pressure, and helping to lift solids out of the borehole and keeping those solids in suspension when drilling stops.<br /><br />Gluten-free is not the same food just without Gluten, something else is added in it's place.  FInd out what and how safe it it is - better yet, just avoid any foods with Gluten if you do have Celiac's disease.  Shortcuts are rarely quite as simple as them may seem in my experience.d or drilling mud to improve its function. Drilling fluid serves several purposes, including cooling the drill bit, providing hydrostatic pressure, and helping to lift solids out of the borehole and keeping those solids in suspension when drilling stops.<br /><br />Gluten-free is not the same food just without Gluten, something else is added in it's place.  FInd out what and how safe it it is - better yet, just avoid any foods with Gluten if you do have Celiac's disease.  Shortcuts are rarely quite as simple as them may seem in my experience.",2013-11-30,50,0.8587
US,3880857,R36XN8RGPLKIAL,B000FFLHU2,761498827,"Navitas Naturals Organic Maca Powder, 1 Pound Pouches",Grocery,1,0.0,2.0,N,Y,Made me and my husband sick after using daily recommended serving size in a smoothie...,"I purchased this after reading up on it, as it's supposed to be excellent for you. However, my husband and I both got sick after using the recommended daily serving in our smoothies. Not sure if it was a &#34;bad&#34; batch, but we sent it back for a refund, as neither of us was willing to try it again...",2013-11-27,364,0.0307
US,20499333,R3QLX2OBV8K45W,B00BG0ZJ0Y,338444197,Matcha DNA Certified Organic Matcha Green Tea,Grocery,1,70.0,139.0,N,Y,It's from China and I don't trust it. I've mostly been sick since I started drinking it.,"I bought it, tried for several weeks, and only found myself getting sick. Don't know if it's the tea or not. But I don't trust consuming any product from China. I will trash this product and look for a source that I can better trust. It also tastes bad.",2013-11-27,728,-0.0979
US,44127524,ROXZHXBC00DJ8,B001SAXKYO,92072060,"Walnuts Halves & Pieces, Raw 5 lbs. - Sincerely Nuts",Grocery,1,5.0,7.0,N,Y,"these people are smart they mixed old and new,some pieces taste ok other rotten.its not organic its not cheap.","these people are smart they mixed old and  new walnuts togather,some pieces taste ok other rotten.its not organic its not cheap(.i am better off with local grocery store.)some of the pieces taste and smell bad and do not taste fresh",2013-11-26,81,-0.453
US,28075273,R1WEGCOP0QY21E,B005FP79WM,900447876,Blue Diamond Almond Nut-Thins,Grocery,1,0.0,2.0,N,Y,Pepper Jack Flavour is icky,"normally, I love nut thin crackers and fill my pantry with them, but the pepper jack cheese flavour is gross. i can't describe it any better than that. It's like a false, powdery, artificial, gross flavour. I'll stick to the non flavoured nut thins.",2013-11-23,16,0.1027
US,6093321,R871VQNSCWRYB,B001YJ9JOO,597162044,"Hormel Chilli No Beans Easy Open Can, 6 Count, 15 Ounce",Grocery,1,7.0,10.0,N,N,soy meat = beans= sick kid,"My daughter is allergic to peanuts, which is a legume.  Because of that, she has an intolerance to all beans - including Soy beans.  Her tongue swells, and her stomach cramps if she eats soy and soy products.  I bought her a couple of cans of  no-bean chili from two different companies, to see which one she would like better.  She ate your Hormel chili No Beans, and after two bites, she couldn't swallow a drink of water, because of the swelling in her throat.  Of course it then occurred to me that you might be stretching your meat, like taco bell does and other companies do to stay &#34;economical&#34;.  So I read (too late) the third ingredient is &#34;textured vegetable Protein&#34; which is fake meat made from soy. Soy is a bean - a legume, specifically, so exactly what I was avoiding by buying &#34;no Bean&#34; chili.  Sorry, you really shouldn't label this product &#34;NO Bean&#34; since the meat is actually made from soy beans.",2013-11-21,6,-0.3182
US,13942539,RV342047M3ZH2,B0045TNRN4,599377376,"Smucker's  Apricot Preserves, 18-Ounce (Pack of 6)",Grocery,1,0.0,1.0,N,Y,"A gooey, dangerous mess!!","I chose this review, not because the product tasted bad, but because the idiot who wrapped the 6 jars for shipping put the jars together in one bag and sent them off in a box containing a heavy 12&#34; deep sauce pan with a dome lid.  Needless to say, these jars of preserves arrived smashed to smithereens and all the other items in the main box were coated with preserves.  A big gooey, dangerous, leaking mess.  The post office delivered the box in a big garbage bag set it on my front porch.  Thanks Amazon!!  Now I would like my whole jars of Pineapple Preserves, individually wrapped and remailed to me.",2013-11-19,36,-0.7604
US,49159641,R2KTWEYK6FUEGH,B000ILLX6G,703570386,"Kernel Season's Cheesy Jalapeno Popcorn Seasoning, 2.4 Ounce Shakers (Pack of 6)",Grocery,1,7.0,7.0,N,Y,Awful...avoid at all costs,Had to give it away. Could not even put it on the popcorn without having a coughing spell. Something is wrong with this.,2013-11-17,73,-0.4767
US,16425239,RE97Q9IVMD2Z1,B00CBOSNQ6,870569471,"Dave's ""Scorpion Pepper"" Special Reserve 2014",Grocery,2,3.0,10.0,N,N,Extremely dangerous.,"Extremely dangerous and cannot be classified under any circumstance as food item.  i can take very very hot food.  I nearly went to the hospital with having just a couple of drops on an entire dish. Violet spasm, difficult breathing, immediate vomiting.<br />I have never come across anything like this in my life.<br />This is a weapon and can cause terrible injury.",2013-11-17,12,-0.8883
