Unnamed: 0,Unnamed: 0.1,marketplace,customer_id,review_id,product_id,product_parent,product_title,product_category,star_rating,helpful_votes,total_votes,vine,verified_purchase,review_headline,review_body,review_date,sentiment_score,food_safety_flag2229652,2229785,US,51861708,R3J43QFIGO0U78,B001EO5UVK,459135175,"RJ's Black Soft Natural Eating Licorice, 10.6-Ounce Bags (Pack of 4)",Grocery,1.0,5.0,24.0,N,Y,Absolutely delicious--- and potentially very dangerous too,"I was enjoying some of this yummy licorice just now while at the computer, my first experience with RJ's. I became curious about the medicinal applications of licorice and searched \\""licorice health\\"". I was stunned to find that licorice root and extract are implicated in a number of potentially serious health problems: hypertension, potassium depletion, heart and kidney failure,  fluid retention and swelling of the face and limbs, hormonal imbalance, and muscle destruction leading to pain and weakness. Licorice can reduce thyroid gland activity and lower basal metabolic rate. Pregnant women should avoid licorice because of danger to the fetus. From the \\""People's Pharmacy\\"" web site:        \\""It appears that individuals vary considerably in their susceptibility to adverse reactions from licorice. Some people experience negative symptoms within days, while others may ingest excessive licorice in candy, chewing gum, chewing tobacco, or herbal medicine for months or even years before they realize that they are suffering damaging effects. Women appear to be somewhat more susceptible than men, and oral contraceptives may increase this sensitivity.         Paralysis of the legs (and in one case, of all of the limbs) has been reported. A sixty-four-year-old man developed pulmonary edema, signaled by fatigue and trouble breathing, after eating four packages of black Twizzlers licorice candy in three days. This case demonstrates how quickly a serious reaction can arise.\\""        Interestingly, most licorice candy sold in the US is made with anise, not licorice flavoring. RJ's however is made from licorice extract... tasty but not worth the risk to me personally as one with a family history of circulatory disorders. Be aware.",2010-09-10,-0.914,1
2231222,2231355,US,23537180,R35H567G78FZWL,B000RCH43M,27079933,DiabeticFriendly Sugar Free Assorted Fruit Gummy Fish (1lb/bulk),Grocery,1.0,1.0,1.0,N,Y,"Taste great, not worth feeling so sick afterwards","The gummy fish do taste like regular sugar gummies, but if you eat only 5- 10 fish, you will end up feeling so sick, it isn't worth eating them. Who eats only one gummy fish? I was afraid to eat more than one afraid I would get sick if I had anymore.   I have had other sugar free gummy candies that don't seem to make you feel so awful, not sure what the difference is, but I will never buy these ones again.",2010-09-01,-0.951,1
2231734,2231867,US,49601921,R3LUCTA3CTDCSR,B000FFLHU2,761498827,"Navitas Naturals Organic Maca Powder, 1 Pound Pouches",Grocery,1.0,107.0,132.0,N,Y,Made me VERY sick,"I have used other brands of Maca with no problem.  This one made me very, very sick to my stomach with pain and nausea.  It took me a few weeks to isolate what was making me sick - had a full gastro work-up and everything - that's how sick I was!  Today, after being healthy again for 2 months I tried 1/2 tsp of maca to test and am sick and nauseous.<br /><br />I know many people take maca with no problems.  I only post this so those who get sick will hopefully not struggle as long as I did to figure out what is causing it.",2010-08-29,-0.9802,1
2232634,2232768,US,52320161,R3HRHO7W7I66BK,B000HQR0ZA,490661620,"Fould8217;s Wacky Mac Macaroni & Cheese Dinner, 5.5-Ounce Boxes (Pack of 8)",Grocery,1.0,0.0,27.0,N,N,Horrible and dangerous for kids!,"How can anyone still feed this to children?  I cannot believe that, given the medical research evidence about the dangers of artificial colors and flavors (of which Wacky Mac and the other Fould's prodcuts have several), anyone would give this to children.  If you want a Kosher mac & cheese, make it from scratch (it is sooo easy) or buy this one instead, which is far healthier:  [...].",2010-08-24,-0.4404,1
2233559,2233693,US,13077508,R6DULTZ5X92B,B000Q92QIE,372077599,"Kraft Easy Mac Original, 2.05-Ounce Microwave Cups (Pack of 36)",Grocery,1.0,0.0,19.0,N,N,got sick,I got sick from eating this that I was sweating cold sweats by my pained tummy. Will. Never. Eat. This. Again.,2010-08-20,-0.7269,1
2235359,2235493,US,10941451,R25XJ0E7ENC0TE,B000ER5CTS,92995222,"Earth's Best Organic Teething Biscuits, 4.6 Ounce Boxes (Pack of 12)",Grocery,2.0,2.0,3.0,N,N,"Tasty, but too dangerous for teething","While these little biscuits are quite tasty and my 9 month old LOVED the first one I gave her, it will be some time before she gets another one.  Within a minute or two the biscuit had broken into pieces just the right size for her to choke on.  These are not the sort of teething biscuits I was looking for.",2010-08-09,-0.2422,0
2245932,2246069,US,51505399,R3T5XZMCJXHGTZ,B0000WADNC,829623069,Boericke & Tafel Florasone Itches & Rashes Cream -- 1 oz,Grocery,5.0,2.0,2.0,N,N,helped poison ivy,"We have tried lots of different things to relieve the itching of poison ivy for our three young boys, and they say this helps the most.  We have been using it for years on bug bites and other itchy rashes.  Time to restock!",2010-06-04,-0.1007,0
2254149,2254286,US,38941441,RCGL3MH4YIOCK,B002EAN3T4,483962453,"Cascadian Farm Organic Purely O's Cereal, 8.6 Ounce Boxes (Pack of 4)",Grocery,1.0,11.0,13.0,N,N,Sneaky and potentially dangerous change,"3 years ago we looked long and hard for a sugar free, whole grain finger food for our then 6 month old.  Our son enjoyed this cereal as a snack and until recently, as a cereal, but then I bought my most recent box and noticed right away they didn't look the same.  When I tasted one I immediately knew they were sweetened and sure enough, when I checked the nutrition label it showed 3g of sugar per serving.  The label is completely unchanged except for the ingredients and this is dangerously misleading.  We live in a country where diabetes is rampant and sugar can be very dangerous.  How frightening that they Cascadian Farms/General Mills would sneak sugar into their cereal without changing any of the main labelling.  I will never buy anything from them again!",2010-04-14,-0.9198,1
2262838,2262976,US,43204909,R1K7B1LKFGEI5R,B000SARJSI,792561286,Davidson's Tea Bulk,Grocery,2.0,2.0,2.0,N,Y,Blech - Made me sick,"I was very excited about getting this item, in fact I paid to have it delivered next day. It sounded delicious. Cherries, coconut, and Chamomile - How can you go wrong, right?    Let's just put it this way: I made my first pot of this around 1pm. by 1:15 that pot was down the drain.     I tried it so many ways. No sugar, little sugar, lots of sugar. Each time I took a sip I gagged. The actual product smells very sharp, and the brewed product had a VOMIT aftertaste. I'm not exaggerating here, it actually reminded me of being sick.     Needless to say, this is the last batch I make of this flavor. It will go into the potted plants for fertilizer.",2010-02-21,-0.5028,1
2263383,2263521,US,36158864,R2REN0LSO0FIS8,B000YTAW0U,245727654,"Azar Nut Company Walnut Halves & Pieces, Honey Maple, 32-Ounce Resealable Bags (Pack of 3)",Grocery,1.0,8.0,8.0,N,Y,"rotten, smelly, expired walnut","None of three bags of walnut is fresh.  When I opened the bag, unpleasant odor came out.  I opened three all, none of them was edible. It contains strong, out-of-dated smell.  I could not find the expiration date on the bag. This produce totally wastes of money.  Keep away from this product. I would choose 0 star if I could. This is the worst experience I ever have in Amazon.  I got to throw all of them away!",2010-02-18,-0.2942,1
2266810,2266948,US,47040158,R37Q5E476DVHB2,B000FIZVY2,463175912,"Dinty Moore Scalloped Potatoes with Ham, 7.5-Ounce Microwavable Bowls (Pack of 12)",Grocery,2.0,1.0,3.0,N,N,"Started off fine, made me nauseous afterwards","While I like Dinty Moore's beef stew, it seems that this is just one product of theirs that I just don't like.<br /><br />The food isn't that appealing- the food was all pale & pasty looking, but looks can be deceiving when it comes to food, so I went ahead & got it anyway. C'mon... ham & potatoes! How can that be ruined?<br /><br />I unfortunately got my answer- you ruin it by loading it up with tons & tons of grease. The first few bites of this weren't bad & I think that if I only had a small portion of it, it wouldn't be such a terrible thing. (Hence the 2 stars rather than 1 star.) I managed to struggle through the bowl (I hate wasting food & had nothing else to eat), but shortly afterwards I just felt sick to my stomach.<br /><br />If you have either a cast iron stomach or you REALLY like food like this, then you'll probably like it. Me? This is just one DM product I'll never be buying again!!",2010-02-03,-0.919,1
2270338,2270476,US,39750706,R24CVFX5PYFKF0,B000MICPUI,148405125,Chef Boyardee,Grocery,1.0,7.0,11.0,N,N,"No Joke, tasted like poison","I am not exaggerating. First off though, I have to mention that i bought a can of this stuff, not the one pictured here. Second, I am probably the least picky person in the world when it comes to junk food so my standards are not very high at all. Third, I have always loved Chef Boyardee products, I was practically raised on them. But when i tried this stuff for the first time, I could not eat more than the first spoonful, and even that was tough to get down. I have to wonder if i purchased a bad can (it didnt look like it though) because this macaroni and cheese tasted like bitter METAL. I am not joking, god honest truth. It didn't taste rancid it just tasted BITTER. I can't imagine even a homeless starving person wanting to eat this. If that is really what the flavor was supposed to be, I have NO idea how they expect kids to eat this stuff. it is absolutely horrible and I can't believe this product sells at all.",2010-01-15,-0.9565,1
2272744,2272882,US,11910250,R1STNWRBJHVIKE,B000YSS7EO,109152662,"Happy Baby Organic Baby Cereals with DHA + Pre & Probiotics, 7 Ounce Canisters (Pack of 6)",Grocery,1.0,5.0,9.0,N,N,Be careful! May be dangerous.,"I bought one of the oatmeal from wholefood and fed it to my baby right away. I was happy about it because she loved it. But after a couple of weeks, one day when my Mom fixed the cereal, she asked me why it has the bad smell. I smelled it, and it does(it's not very strong but does has the smell like when all the nuts or rice turn bad)! I smelled the \\""Earth's best\\"" one I have and it smells pefectly normal. Then I remembered I got a Happy Bellies multi-grain cereal before from [...]. It had not been opened and expires on March 2010. I opened it right away and it has a VERY strong bad smell. It makes me sick for several minutes and feel like there will be something fly out of it! I was really scared! You'd better be careful too since baby won't taste it and you may not find it before it's really bad! I feel so sorry for my baby since I know it's really bad to her health, much worse then giving her non-organic cereal. I won't ever buy the product again no matter how my baby likes it. It makes me really upset and I want to give it negative 5 starts if I could.  BTW, I submitted this reviw to [...] but they didn't publish it. I just hope everyone smell the oat before you give it to your baby.",2009-12-31,-0.9674,1
2275721,2275859,US,52963426,R142YNNDM161ON,B0007VDRHK,172119265,"illy Caffe Normale Fine Grind (Medium Roast, Red Band) 8.8 coffee cans (Pack of 6)",Grocery,4.0,0.0,2.0,N,N,"great product, rotten price",$13.33 a can plus shipping?  Cheaper by more than a few bucks at my local Stop n Shop!!  Unbelievable!!!,2009-12-12,-0.3753,0
2276853,2276991,US,46131607,RW4BSP7HSOOCC,B000FMTJJQ,524084790,"Madhava Organic, Agave Nectar - Light, 11.75-Ounce Squeeze Bottles (Pack of 12)",Grocery,4.0,4.0,4.0,N,N,This can make you sick.,"About 30-40% of the population of Central Europe has trouble digesting fructose.  If you have trouble digesting fructose, it can cause a lot of unexplained abdominal pain.<br /><br />This is almost 100% fructose.<br /><br />Personally, I spent about two months with very bad, mysterious abdominal pain that seemed to be everywhere. After several weeks of doctor visits, discussions about IBS, and an abdominal ultrasound that came up normal, I started thinking about what was different in my diet:  I had been using agave nectar in my tea several times a day.  After throwing out the agave nectar and looking online for a list of lower fructose food, I changed my diet, a little.<br /><br />The pain went away in a matter of days, and hasn't returned.<br /><br />If you're using agave nectar and you have suddenly started having digestive issues, try getting rid of the agave nectar.  For some people, this is really bad stuff.<br /><br />Note:  There is some indication that IBS is actually fructose intolerance.  If this makes you sick, it might just be the fructose.",2009-12-05,-0.975,1
2284022,2284160,US,11416606,R3OMZOXYCNS9BB,B000EGUYNI,503528472,"Mrs. May's Dry-Roasted Snack, Cashew Crunch, 2-Ounce Pouches (Pack of 24)",Grocery,1.0,8.0,12.0,N,N,Product of China - unsafe and not green,"This product is made in China.  I would not believe any claims they make regarding allergy safety and vegan/kosher.  Considering Mrs. May's markets itself as a healthy product, I was shocked when I glanced at the back and noticed this product was made in China. China has proven that we can not trust their manufacturing practices. Unsafe toys, dog food, and now we're supposed to trust them making our health food?     Not to mention the carbon footprint created by shipping something halfway around the world. I will not buy this product anymore.    I would rather purchase the Sahale snacks that are made in the US, even if they are a bit more expensive.",2009-10-16,-0.0526,0
2286429,2286567,US,13446563,RQS9TNOIPGCYM,B001M0746K,9186570,Kool-Aid Drink Mix Packets,Grocery,1.0,2.0,19.0,N,Y,Awful Awful taste...and phosphoric sick color...,"Awful Awful taste...and phosphoric sick color...  Awful Awful taste...and phosphoric sick color...  Awful Awful taste...and phosphoric sick color...    I was totally schemed, this is not a drink. it is an acid poison.  Who for god sake manufacture and sale this kind of awful product.    Don't believe it? try for your self.  I only show \\""The king is naked\\""",2009-09-30,-0.9856,1
2288969,2289107,US,40055094,R1KLI8F5RVOUD1,B001P0VQWU,95732858,"OPTIMUM NUTRITION, 100% WHEY GOLD VARIETY 16/PACK",Grocery,1.0,1.0,9.0,N,Y,"Sucky taste, stinky smell","It is disgusting, not even similar to chocolate taste. It has a strong stench similar to rotten eggs.What a waste.",2009-09-13,-0.8591,1
2292676,2292814,US,50568735,R1OO8X5HXWTCHI,B000RJU8VU,434735874,"Newman's Own Organics Apricots (Dried Fruit), 6-Ounce Pouches (Pack of 12)",Grocery,1.0,3.0,5.0,N,Y,made me very ill--maybe e-coli?,"I ordered 2 boxes of newmans dried apricots.  I understood that the dark color was the lack of preservatives so I ate them anyway and became very ill--vomiting, nausea, chills, dizziness--about an hour or more after eating.  did not occur to me that it was the apricots.  thougnt I had a bad virus.  so--i ate them again.  slow learner--same results.  miserable.  I contacted amazon and they were very gracious and are refunding my money--the remainder of the apricots are in the trash.  Be warned!!!",2009-08-18,-0.7494,1
2296764,2296902,US,21745740,R82VN6K4PAG4Z,B000FMMTHK,162663470,Waggin Train Chicken Jerky Tenders 40oz,Grocery,1.0,9.0,11.0,N,N,If you want your dog to be sick feed them this,"Within 5 minutes of eating the chicken jerky my dog got ill.  She is only 7 lbs.  Vomiting, vomiting blood, lethargy, dehydration.  Vet bills, nights at the emergency vet hospital, you name it.  She ate nothing else in the 4 hours before of eating this.  PLEASE DO NOT GIVE THIS TO YOUR DOGS.  It is not worth it.",2009-07-09,-0.6026,
2304256,2304394,US,39723080,R2EPUPNP0BZ0U9,B000II27QE,186641663,"Heinz Spotted Dick Sponge Pudding, 9.4-Ounce Cans (Pack of 6)",Grocery,1.0,15.0,83.0,N,N,this product is dangerous,I ordered the spotted dick. After eating I felt a little strange. I went to the bathroom and to my horror realized that I had this horrible disease. Luckily 1 gallon 128 Floz Tuscan Whole Milk cleared this up for me.,2009-05-11,-0.8373,1
2305743,2305881,US,44423355,R2DATE68U347BU,B000E1BKRM,574414233,"South Beach Living, Ranch Dressing, 16-Ounce Bottles (Pack of 6)",Grocery,1.0,0.0,1.0,N,N,danger look out,this dressing has phosphoric acid in it all of the name brand ranch dressings do if you look even the H-E-B store brand ranch dressing here in south texas has it a lot of sodas have it to its not good for your teeth and if you are getting a bad taste in your mouth after eating this stuff its because of the phosphoric acid,2009-04-26,-0.7101,1
2306310,2306448,US,39106988,RL6AJIJSYHJOF,B000FL3MI6,368502247,"Gary West Meats, Original Steak Strips, Traditional, 8-Ounce Unit",Grocery,1.0,0.0,1.0,N,N,Made me sick,"It tastes like beef jerky, nothing special, not worth the price, it made me sick stomach did not like it all gave me the runs and smelliest farts ever for two days Green Cloud",2009-04-21,-0.0168,1
2308532,2308670,US,15941950,R3MMETWTJADPEE,B001O2DGY0,151565427,"Earth's Best Organic Gourmet Meals Baby Food, Creamy Chicken Apple Compote, 4 Ounce (Pack of 12)",Grocery,1.0,6.0,6.0,N,N,"rotten, moldy food = health risk","I ordered a flat of food (they were on sale) that contained Chicken Apple Compote Dinner. It contained 3 of this variety and he liked the first one but the others, although properly sealed, were solid and moldy and stinky.    One of the Turkey dinners in the flat was also improperly sealed; the lid popped. We were lucky because I just happened to check that one. Now I'm so paranoid that I check all of them several times. I called Earth's Best and they assured me that they haven't had this problem before and that I shouldn't worry about it. I'm so suprised that this got passed QA/QC inspection at a baby food manufacturer. Why would a company take the risk of bad publicity when baby food manufacturers rely so much on a reputation of safety?!     We also recently opened 5 other jars in this flat after my son refused to eat them and realized that they were rotten.  3 of them were completely solid and domed at the top!  We poked a toothpick down to the bottom of the jar and it was dry throughout.  Shortly after eating his last dinner of this box, my son started vomiting and refused to eat.  We have contacted the USDA about this.  If this happens to you, please same your jars so you can give them the information they need.  It may prevent other babies from getting sick.    I'll never buy anything from Earth's Best again!",2009-04-02,-0.455,1
2310958,2311096,US,11671855,R3GPVOKINTVT6G,B001ELL62A,8923735,"Albanese Citrus Fruit Wedges Sanded, Sugar Free, 4.5-Pound Bags (Pack of 2)",Grocery,1.0,1.0,1.0,N,N,"Vile, awful candy that will make you sick","To start off, as it is sugar free, most sugar free candies contain sugar alcohols, which do not agree with your stomach. If you eat more than 1 serving which is a few pieces, the candy will in turn have a very adverse \\""laxative\\"" affect on you and is extremely discomforting.    That being said, this candy just tastes bad. The product I received seemed to be half melted and all stuck together. the little white dots on the slices are some kind of weird paste and they dont have a pleasant taste.     I dont recommend this to anyone",2009-03-13,-0.8885,1
2324596,2324734,US,14411999,R1BU140PA0SRVK,B000HDI0DO,826261252,"Orville Redenbacher's Gourmet Microwavable Popcorn, Smart Pop Butter, 36-Count Bags",Grocery,1.0,1.0,3.0,N,N,Horrible popcorn bad stink of fake butter that stays in your home for weeks.,Hello i dont usually write bad reviews but this product is horrid.It stinks of fake butter that stays in your house for weeks...Product received was one year outdated and is not recommended to anyone.Dont buy it you will be sorry...,2008-11-04,-0.7659,1
2336199,2336339,US,34124346,RD2BC7LGCEM5V,B000ETXO8M,666166475,"Gustaf's Dutch Licorice, Double Salt, 7-Ounce Containers (Pack of 6)",Grocery,1.0,3.0,11.0,N,Y,Not salt- ammonia,"OH my gosh.  Don't call it salted when there's no salt in it.  The \\""salt\\"" comes from ammonium chloride.  Eat more than one, and the fumes-- the fumes fill your nose and mouth and you breathe ammonia.  Totally gross.     I'm giving these away to the kids for Halloween.",2008-06-25,-0.4641,1
2337577,2337717,US,15476738,R24H114FOL5M2H,B00014E3LM,127590911,Sugar-Free Jelly Belly - 2.8 oz Bag,Grocery,1.0,8.0,10.0,N,N,made me sick,"I'm a perfectly healthy individual with no allergies, etc., but these made me extremely sick. Unfortunately I was on an airplane (they sell these at airport kiosks) and had the worst flight of my life--extreme cramping, bloating, and vomiting--all on southwest airlines. No warning about this side effect on the bag. Thanks a lot, Jelly Belly.",2008-06-12,-0.9355,1
2342935,2343075,US,14671205,R3CNZDXI7CO7I3,B000EF18WU,705473714,"Crown Prince Kipper Snacks, 3.25-Ounce Packages (Pack of 24)",Grocery,1.0,3.0,22.0,N,Y,Crown Prince Kipper Snacks...very stinky and hard to open,"Crown Prince Kipper Snacks, 3.25-Ounce Cans (Pack of 24) is not a good product.  It doesn't taste very good, it is extremely smelly, and the tab to open (like an old style coke can) frequently breaks...resulting in using a can opener or knife to open.  Once that juice splashes in your kitchen (or or your clothes is worse) you have a stench that last for days for a weird-tasting product that wasn't even worth it in the first place.    Needless to say, I will never buy it again.",2008-04-13,-0.8307,1
2343531,2343671,US,47030935,RTVR1YKXH4ONA,B000V0OMVC,503708372,"Zola Acai Power Juice, Acai & Blueberry, 11-Ounce Units (Pack of 12)",Grocery,1.0,0.0,0.0,N,N,"Awful - made me sick, literally!","This stuff tastes all right (the original is better) but it made me REALLY sick one day!  I know it was the Zola, I didn't have anything else all morning but that, and then in a couple of hours, I was vomiting.      Never again will I buy this stuff!",2008-04-07,-0.7859,1
2348662,2348802,US,39543790,RK4HF1YEOZPL4,B00029KG5S,375967346,Lotte - Koala's March Strawberry Cream Cookies FAMILY SIZE 9.5 Oz.,Grocery,1.0,0.0,0.0,N,N,The smell/taste made me terribly ill,"Opening the pouch of these little beasties smelled like I was walking into a nail salon - literally. It was horrendous! But to make sure that it wasn't something odd in the packaging material, I decided to take a small bite of one... *gag!!!* It tasted as bad as it smelled! Perhaps it was something in the artificial strawberry flavoring (and others have commented equally strenuously) but in my opinion, these smell and taste highly toxic and - frankly - poisonous.  Wish I had known before buying them that they were like this... money wasted, to be sure. Might call the FDA and see if these should even be on the market.    (P.S. - I would have given this no stars if I could)",2008-02-13,-0.8082,1
2351916,2352056,US,18163770,RLSV93Z23ZC07,B000J4GIH6,210437196,"Bare Fruit Organic Dried Cherries, 16-Ounce Bags (Pack of 2)",Grocery,1.0,30.0,32.0,N,N,"Bare Fruit cherries review- long delay, moderate taste, unsafe pits","I purchase the multi-pack of small (individual serving) dried cherries, but those are no longer listed, but this is the same product from the same company in a different size.    1. I received my order /months/ after my Amazon order (there was an interim point at which Amazon emailed me to see if I wanted to cancel the order). Amazon did not show out-of-stock at the time of order, so buyer beware.    2. As other raters have mentioned, the taste is moderate, although the longer you chew them, the more you can taste a subtle cherry flavor. The flavor isn't as strong as I expected, but I like variety, so this point alone wouldn't have stopped me from buying    3. These have pits! I find at least 1-2 in every bag. In addition, I find another several cherries with \\""crunchy bits\\"" which I suspect are remnants from pits that have chipped or broken during the de-pitting process. I've ended up eating these from the bag (very carefully), because they aren't safe enough to cook in muffins or breads (one of my original goals), because then you wouldn't be able to see when you are biting into one and the chance of dental damage would be even higher.    I have ordered other dried fruit from Bare Fruit, and enjoyed them very much (apples, mango, etc.) but I cannot recommend their cherries. I hope my review saves someone a chipped tooth.",2008-01-13,-0.711,1
2353323,2353463,US,14459819,R3PMPGIPFHGPFP,B000Q6K3DC,352232115,Fizzies Candy Drink Tablets ASSORTED Six Pack,Grocery,1.0,7.0,29.0,N,N,Chemical poison?,"One of the worst things I have ever tasyed that was supose to be drinkable. Under fizzed and over chemicalled. My Grand children tasted it and got sick. Nothing like the real \\""Fizzies\\"" of old. Reccogmended only for suicides to hide the taste of the poison-naw it might make you throw up and screw up the suicide attempt. They only sell it in large quantities because after tasting one no one would ever buy a second one.",2007-12-31,-0.9361,1
